Name,Surname,Application type,Task,Status,Assignee,Due date,Priority,Completed,Description,Attach file,Updated at,Effort level
Jean , Theron -3 credits available,Section 16,Application Received,Done,L Potgieter,15/07/2026,High,Yes,Application recieved from Tally,,15/07/2026,
,,,Payment Confirmed,Done,Credits,15/07/2026,High,Yes,Payment confirmed via Yoco/EFT,,15/07/2026,High
,,,Preparing Documents,Done,MP Vorster,17/07/2026,High,No,Preparing all documents as requested,,17/07/2026,Medium
,,,Quality Assurance Review,In progress,Johan De Beer,17/07/2026,High,No,Quality check on all documents,,17/07/2026,High
,,,Documents Ready,Not started, L Potgieter,17/07/2026,High,No,Documents finalized and approved,,15/07/2026,high
,,,Documents sent,Not started, L. Potgieter,17/07/2026,High,No,Documents sent to client,,15/07/2026,


