Name,Surname,Application type,Task,Status,Assignee,Due date,Priority,Completed,Description,Attach file,Updated at,Effort level
Sibusiso,Nkosi,Section 13- 4 credits available,Application Received,Done,L Potgieter,01/05/2026,High,Yes,Application recieved from Tally,,29/05/2026,
,,,Payment Confirmed,In progress ,Credits,01/05/2026,High,Yes,Payment confirmed via Yoco/EFT,,29/05/2025,High
,,,Preparing Documents,In progress,MP Vorster,01/05/2026,High,No,Preparing all documents as requested,,29/05/2025,Medium
,,,Quality Assurance Review,Not started,Johan De Beer,01/05/2026,High,No,Quality check on all documents,,29/05/2026,High
,,,Documents Ready,Not started,L Potgieter,01/05/2026,High,No,Documents finalized and approved,,29/05/2026,

,,,Documents sent,Not started, Email,01/05/2026,High,No,Documents sent to client,,29/05/2026,


